"","Ô..The.Project.Gutenberg.EBook.of.Rig.Veda.Americanus..by.Various"
"803","The name of Ayopechcatl does not appear among the divinities named by"
"804","Sahagun, Duran or the other authorities at my command. Her name"
"805","indicates her function as the goddess of the child-bed and the neonatus,"
"806","and the above hymn establishes her claim to a place in the Aztec"
"807","pantheon."
"808","XIII. _Ciuacoatl icuic._"
"809","  1. Quaui, quaui, quilaztla, coaeztica xayaualoc uiuiya quauiuitl"
"810","uitzalochpa chalima aueuetl ye colhoa."
"811","  2. Huiya tonaca, acxolma centla teumilco chicauaztica, motlaquechizca."
"812","  3. Uitztla, uitztla, nomactemi, uitztla, uitztla nomactemi, a√ßan"
"813","teumilco chicauaztica motlaquechizca."
"814","  4. Malinalla nomactemi, a√ßan teumilco chicauaztica motlaquechizca."
"815","  5. A omei quauhtli, ye tonanaya chalmecatecutli ay tziuac y mauiztla"
"816","nechyatetemilli, yeua nopiltzinaya mixcoatla."
"817","  6. Ya tonani, yau√ßiuatzin, aya tonan yau√ßiuatzi aya y maca coliuacan y"
"818","yuitla y potocaya."
"819","  7. Ahuiya ye tonaquetli, yautlatocaya, ahuiya ye tonaquetli"
"820","yautlatocaya moneuila no tlaca cenpoliuiz aya y maca coliuaca y yuitla y"
"821","potocaya."
"822","  8. Ahuia quauiuitl amo xayaualli onauiya yecoyametl amo xayaualli."
"823","_Var._ 1. Cohoaeztica. 2. Acxoima. 7. Maneuila, cenpoalihuiz, inmaca."
"824","_Gloss._"
"825","  1. _Q.n._, in quauhcihuatl, ic oxaualoc in coaetztli, ioan in quauhtli"
"826","yhuitli in moteneua iquauhtzon, ipan iualuicoc yn umpa colhuacan."
"827","  2. _Q.n._, inic motocaya √ßentli, in mochiuaya teumilpa, ichicauaztica"
"828","inic tlatatacaya, inic tocaya."
"829","  3. Uitztla, _q.n._, nomactemi nochicauaztica inic nitocaya, inic"
"830","nitlatatacaya."
"831","  4. Malinalla, uictli, _q.n._, uictica in tlachpanaya, _id est_,"
"832","iceliniquia, yn uncan teumilpan auh ychicauaztica inic nitlatatacaya,"
"833","inic tocaya."
"834","  5. _Q.n._, matlactli omei quauhtli yn notonal innamona auh ynan"
"835","nopilhoan in chalmeca xicuiti in tziuactli xinechtemilica."
"836","  6. _Q.n._, in iyauciuatzin yn amona umpa nochan in coluaca auh in"
"837","quauiuitl nictemaca ynic oquauhtiuac."
"838","  7. _Q.n._, ca otonac ca otlatuic momochiua yauyutl ma tlamalo"
"839","tlalpiliuiz nic temaca in quauiuitl."
"840","  8. _Q.n._, aahuia yn otlamaloc in quauiuitl yc moxaua."
"841","_Hymn to Cihuacoatl._"
"842","  1. Quilaztli, plumed with eagle feathers, with the crest of eagles,"
"843","painted with serpents' blood, comes with her hoe, beating her drum, from"
"844","Colhuacan."
"845","  2. She alone, who is our flesh, goddess of the fields and shrubs, is"
"846","strong to support us."
"847","  3. With the hoe, with the hoe, with hands full, with the hoe, with"
"848","hands full, the goddess of the fields is strong to support us."
"849","  4. With a broom in her hands the goddess of the fields strongly"
"850","supports us."
"851","  5. Our mother is as twelve eagles, goddess of drum-beating, filling"
"852","the fields of tzioac and maguey like our lord Mixcoatl."
"853","  6. She is our mother, a goddess of war, our mother, a goddess of war,"
"854","an example and a companion from the home of our ancestors (Colhuacan)."
"855","  7. She comes forth, she appears when war is waged, she protects us in"
"856","war that we shall not be destroyed, an example and companion from the"
"857","home of our ancestors."
"858","  8. She comes adorned in the ancient manner with the eagle crest, in"
"859","the ancient manner with the eagle crest."
"860","_Notes._"
"861","Cihuacoatl was the mythical mother of the human race. Her name,"
"862","generally translated serpent woman, should be rendered woman of
twins or bearing twins, as the myth related that such was her"
"863","fertility that she always bore two children at one lying-in."
"864","(Torquemada, _Monarquia Indiana_, Lib. VI., cap. 31.) She was also known"
"865","by the title _Tonan_ or _Tonantzin_, our mother, as in v. 5 and 6."
"866","Still another of her appellations was _Quilaztli_, which is given her in"
"867","v. 1. (Comp. Sahagun, _Historia_, Lib. VI., cap. 27.) She was"
"868","essentially a goddess of fertility and reproduction. The name"
"869","_cihuacoatl_ was also applied to one of the higher magistrates and war"
"870","chiefs in the Aztec army (Sahagun). Reference is made to this in v. 6."
"871","As a goddess of venerable antiquity, she is spoken of as coming from"
"872","Colhuacan, the place of the old men, or of the ancestors of the tribe."
"873","This name is derived from _coloa_, to bend down, as an aged person,"
"874","_colli_, an old man. (See my _Ancient Nahuatl Poetry_, pp. 172-3)."
"875","XIV. _Izcatqui yn cuicatl chicuexiuhtica meuaya iniquac atamalqualoya._"
"876","  1. Xochitl noyollo cuepontimania ye tlacoyoalle, oaya, oouayaye."
"877","  2. Yecoc ye tonan, yecoc ye teutl tlacolteutla, oaya, ooayaya."
"878","  3. Otlacatqui √ßenteutl tamiyoanichan ni xochitlicacani. √áey xochitli"
"879","yantala, yantata, ayyao, ayyaue, tilili yao, ayaue, oayyaue."
"880","  4. Otlacatqui √ßenteutl, atl, yayaui cani tlaca pillachiualoya"
"881","chalchimichuacan, yyao, yantala, yatanta, a yyao, ayyaue tilili yao,"
"882","ayyaue, oayyaue."
"883","  5. Oya tlatonazqui tlauizcalleuaya inan tlachinaya nepapan quechol,"
"884","xochitlacacan y yantala, yantata, ayyao, ayyaue, tilili yao, ayyaue,"
"885","oayyayaue."
"886","  6. Tlalpa timoquetzca, tianquiz nauaquia nitlacatla, ni quetzalcoatla,"
"887","yyao, yantala, yantata, ayyao, ayyaue, tilili yao ayyaue, oayyayue."
"888","  7. Ma ya auiallo xochinquauitl itlani nepapan quecholli ma ya in"
"889","quecholli xicaquiya tlatoaya y toteuh, xicaquiya tlatoaya y quechol"
"890","amach yeua tonicauh tlapitza amach ychan tlacaluaz, ouao."
"891","  8. Aye oho, yyayya, √ßa miquiyecauiz √ßa noxocha tonaca xochitli ye"
"892","izqui xochitla, xochitlicacan, yyaa."
"893","  9. Ollama, ollama uiue xolutl nauallachic, ollama ya xolutl"
"894","chalchiuecatl xiquitta mach, oya moteca piltzintecutli yoanchan,"
"895","yoanchan."
"896","  10. Piltzintle, piltzintle to√ßuitica timopotonia tlachco, timotlalli"
"897","yoanchan, yoanchan."
"898","  11. Oztomecatla yyaue, oztomecatla xochiquetzal quimama, ontlatca"
"899","cholola, ayye, ayyo, oye maui noyol, oye maui noyol, aoya yecoc"
"900","centeutl, matiuia obispo, oztomecatl chacalhoa, xiuhnacochtla, yteamic"
"901","ximaquiztla yteamico, ayye, ayye."
"902","  12. Cochina, cochina, cocochi ye nicmaololo, ni cani ye √ßiuatl ni"
"903","cochina yyeo, ouayeo, yho, yya, yya."
"904","_Var._ 3. √áenteuteutl. 4. Uillachiualoia. 5. Oya tonazqui. 6. Tlapan."
"905","10. Timotlalia. 11. Suchiquetzal. Ontlatoa cholollan."
"906","_This is the Hymn which they sang every eight years when they fasted on"
"907","bread and water._"
"908","  1. The flower in my heart blossoms and spreads abroad in the middle of"
"909","the night."
"910","  2. Tonan has satisfied her passion, the goddess Tlazolteotl has"
"911","satisfied her passion."
"912","  3. I, Cinteotl, was born in Paradise, I come from the place of"
"913","flowers. I am the only flower, the new, the glorious one."
"914","  4. Cinteotl was born from the water; he came born as a mortal, as a"
"915","youth, from the cerulean home of the fishes, a new, a glorious god."
"916","  5. He shone forth as the sun; his mother dwelt in the house of the"
"917","dawn, varied in hue as the quechol bird, a new, a glorious flower."
"918","  6. I came forth on the earth, even to the market place like a mortal,"
"919","even I, Quetzalcoatl, great and glorious."
"920","  7. Be ye happy under the flower-bush varied in hue as the quetzal"
"921","bird; listen to the quechol singing to the gods; listen to the singing"
"922","of the quechol along the river; hear its flute along the river in the"
"923","house of the reeds."
"924","  8. Alas! would that my flowers would cease from dying; our flesh is as"
"925","flowers, even as flowers in the place of flowers."
"926","  9. He plays at ball, he plays at ball, the servant of marvellous"
"927","skill; he plays at ball, the precious servant; look at him; even the"
"928","ruler of the nobles follows him to his house."
"929","  10. O youths! O youths! follow the example of your ancestors; make"
"930","yourselves equal to them in the ball count; establish yourselves in your"
"931","houses."
"932","  11. She goes to the mart, they carry Xochiquetzal to the mart; she"
"933","speaks at Cholula; she startles my heart; she startles my heart; she has"
"934","not finished, the priest knows her; where the merchants sell green jade"
"935","earrings she is to be seen, in the place of wonders she is to be seen."
"936","  12. Sleep, sleep, sleep, I fold my hands to sleep, I, O woman, sleep."
"937","_Notes._"
"938","In default of a Gloss to this hymn, the indispensable Sahagun again"
"939","comes to our aid. He informs us in the Appendix to the second book of"
"940","his _Historia_ that When the Indians celebrated the festival called
_atamalqualiztli_, which took place every eight years, certain natives
called Mazateca swallowed living serpents and frogs, and received
garments as a recompense for their daring. We are not informed as to"
"941","the purpose of the festival, and its name, which signifies eating
bread made with water, is merely that of one of the regular systems of"
"942","fasting in vogue in ancient Mexico. (See Sahagun, Lib. III., cap. 8.)"
"943","The song before us appears to be a recitation calling on a number of the"
"944","Nahua divinities."
"945","  1. The flower in my heart is a metaphorical expression for song."
"946","  2. _Tonan_, Our Mother; _Tlazolteotl_, the goddess of lascivious"
"947","love, _Venus impudica_. The verb _yecoa_ appears to have its early"
"948","signification, expressing carnal connection."
"949","  3. _Centeotl_, god of maize and fertility."
"950","  8. The flowers referred to are the youths and maidens who die young."
"951","  9. The house of the ball player is the tomb."
"952","  11. This verse is very obscure and is obviously corrupt. It contains"
"953","the only Spanish word in the text of these hymns--_obispo_--a word"
"954","including two letters, _b_ and _s_, not in the Nahuatl alphabet."
"955","  12. The woman referred to is Xochiquetzal. See Hymn IX."
"956","[Illustration: PRIEST OF XIPPE TOTEC, DRINKING AND PLAYING ON A DRUM."
"957","HYMN XV.]"
"958","XV. _Xippe icuic, Totec, yoallauana._"
"959","  1. Yoalli tlauana, iztleican nimonenequia xiyaqui mitlatia"
"960","teocuitlaquemitl, xicmoquenti quetlauia."
"961","  2. Noteua chalchimamatlaco, apana, y temoya ay quetzallaueuetl, ay"
"962","quetzalxiuicoatl, nechiya iqui nocauhquetl, ouiya."
"963","  3. Maniyauia, nia nia poliuiz, ni yoatzin achalchiuhtla noyollo,"
"964","ateucuitlatl nocoyaitaz, noyolceuizqui tlacatl achtoquetl tlaquauaya,"
"965","otlacatqui yautlatoaquetl ouiya."
"966","  4. Noteua ce in tlaco xayailiuiz √ßonoa y yoatzin motepeyocpa"
"967","mitzualitta moteua, noyolceuizquin tlacatl achtoquetl tlaquauaya,"
"968","otlacatqui yautlatoaquetl, ouiya."
"969","_Var._ 1. Quetloujia. 2. Noteuhoa chalchimmama tlacoapana itemoia. 3."
"970","Achalchiuhtla. 4. Centlaco, mitzualitla."
"971","_Gloss._"
"972","  1. _Q.n._, yn ti yoallauana, ti xipe, totec, tleica in ti monequi in"
"973","timo√ßuma, in timotlatia, _id est_, tleica in amo quiauiteocuitlaquemitl,"
"974","xicmoquenti, _q.n._, ma quiaui, ma ualauh yn atl."
"975","  2. _Q.n._, yn ti noteuh, otemoc in mauhoualla yn mauh; ay quetzalla"
"976","ueuetl, _id est_, ye tlaquetzalpatia ye tlaxoxouia, ye xopantla. Ay"
"977","quetzal xiuhcoatl nechia iqui no cauhquetl, _id est_, ca ye otechcauh yn"
"978","mayanaliztli."
"979","  3. _Q.n._, ma mauh, ma nipoliui yn ni yoatzin, _id est_, in catleuatl,"
"980","yuhquin chalchiuitl noyollo. A teocuitlatl nocoyaitaz, _q.n._, in"
"981","catleuatl achtomochiuaz ninoyolceuiz."
"982","  4. _Q.n._, yn oteuh cequi tlatlacotyan in mochiua initonacayouh,"
"983","auh in tlein tlatlacotyan achto mochiua mochi tlacatl achto mitzualmaca,"
"984","auh iniquac ye omochimochiuh occeppa nomochi tlacatl mitzualmaca yn"
"985","motonacayuh."
"986","_Hymn of the High Priest of Xipe Totec._"
"987","  1. The nightly drinking, why should I oppose it? Go forth and array"
"988","yourselves in the golden garments, clothe yourselves in the glittering"
"989","vestments."
"990","  2. My god descended upon the water, into the beautiful glistening"
"991","surface; he was as a lovely water cypress, as a beauteous green serpent;"
"992","now I have left behind me my suffering."
"993","  3. I go forth, I go forth about to destroy, I, Yoatzin; my soul is in"
"994","the cerulean water; I am seen in the golden water; I shall appear unto"
"995","mortals; I shall strengthen them for the words of war!"
"996","  4. My god appears as a mortal; O Yoatzin, thou art seen upon the"
"997","mountains; I shall appear unto mortals; I shall strengthen them for the"
"998","words of war."
"999","_Notes._"
"1000","There is slight mention of the deity Xipe Totec in the Spanish writers."
"1001","He was the patron divinity of the silversmiths, and his festival,"
"1002","attended with peculiarly bloody rites, was celebrated in the first month"
"1003","of the calendar. (Duran, _Historia_, cap. 87; Sahagun, Lib. I., cap. 18,"
"1004","Lib. II., cap. 21, etc.) Totec is named as one of the companions of"
"1005","Quetzalcoatl, and an ancient divinity whose temple stood on the"
"1006","_Tzatzitepec_ (see the _Codex Vaticanus_; Tab. XII., in Kingsborough's"
"1007","_Mexico_). His high priest was called _Youallauan_, the nocturnal
tippler (_youalli_, night, and _tlauana_, to drink to slight"
"1008","intoxication), and it was his duty to tear out the hearts of the human"
"1009","victims (Sahagun, _u.s._). The epithet _Yoatzin_, noble night-god,"
"1010","bears some relation to the celebration of his rites at night."
"1011","[Illustration: CHICOMECOATL, GODDESS OF FOOD AND DRINK. HYMN XVI.]"
"1012","XVI. _Chicomecoatl icuic._"
"1013","  1. Chicomollotzin xayameua, ximi√ßotica aca tona titech icnocauazqui"
"1014","tiyauia mochan tlallocan nouia."
"1015","  2. Xayameua ximi√ßotica aca tonan titech icnocauazqui tiyauian mochan"
"1016","tlallocan nouiya."
"1017","_Var._ 1. Xaia mehoa."
"1018","_Gloss._"
"1019","  1. _Q.n._, yn ti chicomolotl, _id est_, in ti centli ximeua, xi√ßa,"
"1020","xixoa, ca otimouicaya in mochan tlallocan."
"1021","  2. _Q.n._, xayameua, _id est_, ximeua, xixua, xi√ßa, ca otimouicaya in"
"1022","mochantzinco in tlallocan ca yuhquin ti tonatzon."
"1023","_Hymn to Chicomecoatl._"
"1024","  1. O noble Chicomolotl, arise, awake, leave us not unprotected on the"
"1025","way, conduct us to the home of Tlaloc."
"1026","  2. Arise, awake, leave us not unprotected on the way, conduct us to"
"1027","the home of Tlaloc."
"1028","_Notes._"
"1029","The goddess Chicomecoatl, seven guests, was the deity who presided"
"1030","over food and drink. Hence in the first verse she is referred to as"
"1031","Chicomolotl, seven ears of corn, and is spoken of as a guide to"
"1032","Tlalocan, or the home of abundance."
"1033","Father Duran, who gives a long chapter on this goddess (_Historia_, cap."
"1034","92), translates her name serpent of seven heads, and adds that she was"
"1035","also called _Chalciucihuatl_, Lady of the Emerald, and _Xilonen_,"
"1036","goddess of the tender ears of maize. Every kind of seed and vegetable"
"1037","which served for food was under her guardianship, and hence her festival,"
"1038","held about the middle of September, was particularly solemn. Her statue"
"1039","represented her as a girl of about twelve years old."
"1040","[Illustration: TOTOCHTIN, THE RABBITS, GODS OF THE DRUNKARDS. HYMN XVII.]"
"1041","XVII. _Totochtin incuic Tezcatzoncatl._"
"1042","  1. Yyaha, yya yya, yya ayya, ayya ouiya, ayya yya, ayya yya, yyauiyya,"
"1043","ayya ayya, yya ayya, yya yya yye."
"1044","  2. Coliuacan mauizpan atlacatl ichana, yya ayya, yyayyo."
"1045","  3. Tezcatzonco tecpan teutl, macoc ye chocaya, auia, macaiui, macayui"
"1046","teutl, macoc yye chocaya."
"1047","  4. Auia axalaco tecpanteutl, macoc yye chocaya, macayui, macayui"
"1048","teutl, macoc yye chocaya."
"1049","_Var._ 3. Tezcatzoncatl tepan. 4. Axalaca."
"1050","_Gloss._"
"1051","  1. Y tlauelcuic, tlauelcuica."
"1052","  2. Coliuacan mauizpa tlacatlichana, _q.n._, in tlacatl, _id est_,"
"1053","octli ompa ichan ni colhoacan. Mauizpa, _q.n._, temamauhtican."
"1054","  3. Tezcatzonco tecpanteutl, _q.n._, ye choca in omacoc teutl"
"1055","tezcatzonco tecpan, _id est_, octli. Quimonacayotia in teutl. Macaiui"
"1056","teutl, _q.n._, macamo omatoni in teutl, _id est_, octli, ye choca cayamo"
"1057","ynemac."
"1058","  4. Aia axalaco tecpanteutl, _q.n._, axala in tecpanteutl. Ye choca yn"
"1059","omacoc, _id est_, octli axalatecpan, ye choca in omacoc, macamo omaco ni"
"1060","ye choca cayamo ynemac."
"1061","_Hymn to Tezcatzoncatl Totochtin._"
"1062","  1. Alas! alas! alas! alas! alas! alas!"
"1063","  2. In the home of our ancestors this creature was a fearful thing."
"1064","  3. In the temple of Tezcatzoncatl he aids those who cry to him, he"
"1065","gives them to drink; the god gives to drink to those who cry to him."
"1066","  4. In the temple by the water-reeds the god aids those who call upon"
"1067","him, he gives them to drink; the god aids those who cry unto him."
"1068","_Notes._"
"1069","Tezcatzoncatl was one of the chief gods of the native inebriating"
"1070","liquor, the pulque. Its effects were recognized as most disastrous, as"
"1071","is seen from his other names, _Tequechmecaniani_, he who hangs people,"
"1072","and _Teatlahuiani_, he who drowns people. Sahagun remarks, They
always regarded the pulque as a bad and dangerous article. The word"
"1073","_Totochtin_, plural of _tochtli_, rabbit, was applied to drunkards, and"
"1074","also to some of the deities of special forms of drunkenness."
"1075","The first verse is merely a series of lamentations. The second speaks of"
"1076","the sad effects of the pulque in ancient times. (On Colhuacan see Notes"
"1077","to Hymn XIII.)"
"1078","[Illustration: ATLAUA, SINGING AND DANCING. HYMN XVIII.]"
"1079","XVIII. _Atlaua Icuic._"
"1080","  1. Auia nichalmecatl, nichalmecatl, ne√ßaualcautla, ne√ßaualcautla, olya"
"1081","quatonalla olya."
"1082","  2. Ueya, ueya, macxoyauh quilazteutl y tlapani macxoyauh."
"1083","  3. Nimitz acatecunotzaya, chimalticpao mone√ßoya nimitzacatecunotzaya."
"1084","  4. Ayac nomiuh timalla aytolloca nacatl nomiuh aca xeliui timalla."
"1085","  5. Tetoma amo yolcana tlamacazquinte tometl, a√ßan axcan ye"
"1086","quetzaltototl, nic ya izcaltiquetla."
"1087","  6. Y yopuchi noteuh atlauaquetl, a√ßa naxcan ye quetzaltototl, nic ya"
"1088","izcaltiquetla."
"1089","  1. Ne√ßaualcactla. 2. Itlamani. 4. Aitollaca acatl. Timalli. 5. Tetonac"
"1090","amo yolcana tlamacaz quin tetometl."
"1091","_Gloss._"
"1092","  1. _Q.n._, ynichalmecatl, yn ine√ßaualac oqixicauhteuac y nioholti, y"
"1093","nioya, ixquatechimal iquatunal."
"1094","  2. _Q.n._, ma xiyauh ti quilazteutl, momactemi in macxoyauh."
"1095","  3. _Q.n._, iniquac onimitznotz, mochimalticpac timi√ßoya."
"1096","  4. _Q.n._, atle nomiuh yc notimaloa, ca uel itoloc in acatl nomiuh, yn"
"1097","acatl xeliui yc ninotimaloa."
"1098","  5. _Q.n._, oncan euac in tetuman nitlacochtetumetl. Auh inaxcan ye"
"1099","quetzaltotol inic ni tlazcaltia."
"1100","  6. _Q.n._, tiacauh in oteuh in atlaua, auh inaxcan yuhqui quetzaltotol"
"1101","in nitlazcaltia."
"1102","_The Hymn of Atlaua._"
"1103","  1. I Chalmecatl, I Chalmecatl, I leave behind my sandles, I leave my"
"1104","sandles and my helmet."
"1105","  2. Go ye forth and follow the goddess Quilaztli, follow her"
"1106","  3. I shall call upon thee to arise when among the shields, I shall"
"1107","call upon thee to arise."
"1108","  4. I boast of my arrows, even my reed arrows, I boast of my arrows,"
"1109","not to be broken."
"1110","  5. Arrayed in priestly garb, take the arrow in thy hand, for even now"
"1111","I shall arise and come forth like the quetzal bird."
"1112","  6. Mighty is my god Atlaua; truly I shall arise and come forth like"
"1113","the quetzal bird."
"1114","_Notes._"
"1115","_Atlaua_, mentioned by Olmos, who translates the word Master of
waters, is a divinity of whom little is known. The derivation from"
"1116","_atlatl_, arrow, would seem more appropriate to the words of this hymn."
"1117","_Chalmecatl_, used as a synonym in v. 1, appears to be from _chalania_,"
"1118","to beat, to strike, as a drum."
"1119","On _Quilaztli_ see notes to Hymn XIII."
"1120","XIX. _Macuilxochitl Icuic._"
"1121","  1. Ayya, yao, xochitlycaca umpan iuitza tlamacazecatla tlamocoyoalca."
"1122","  2. Ayya, yao, ayo intinotzicaya teumechaue oya, yao, tlauizcalac"
"1123","yacallea tlamacazecatlo tlamocoyoualca."
"1124","  3. Tetzauhteutla notecuyo tezcatlipuca quinanquilican √ßinteutla, oay."
"1125","  4. Tezcatzonco moyolca ayyaquetl yya tochin quiyocuxquia noteuh,"
"1126","niquiyatlacaz, niquiyamamaliz, mixcoatepetl colhoacan."
"1127","  5. Tozquixaya, nictzotzoniyao, yn tezcatzintli tezcatzintli"
"1128","tezcaxocoyeua, tzoniztapaliati tlaoc xoconoctlia ho, a."
"1129","1. Tlamocoioaleua. 5. Tozquiuaia. Tzoniztapalatiati."
"1130","_Gloss._"
"1131","  1. _Q.n._, ompa nochan in xochitlicacan in itlamacazqui ni"
"1132","macuilxochitl."
"1133","  2. _Q.n._, motilinia in tino√ßi in ompa titlaecoltilozque umpa tochan"
"1134","ez."
"1135","  3. _Q.n._, yn tetzauitl in tezcatlipoca ca oyaque auh ynic tiui umpa"
"1136","titlananquilizque in centeotl."
"1137","  4. Tezcatzonco moyolcan, _q.n._, tezcatzonco oyol in tochtli ynic yaz,"
"1138","oquiyocux, oquipic, y noteuh oquito nittla√ßaz, nicmamaliz, in"
"1139","mixcoatepetl colhoacan, _id est_, nictepeuaz."
"1140","  5. Tozquixaya nictzotzomiao, _q.n._, nictzotzona, in tezcatzintli"
"1141","oncan nexa in tezcatzonco, oncan oyol tzoniztapalatiati ocxoni ni octli."
"1142","_Hymn to Macuilxochitl._"
"1143","  1. Yes, I shall go there to-night, to the house of flowers; I shall"
"1144","exercise the priestly office to-night."
"1145","  2. We labor in thy house, our mother, from dawn unto night, fulfilling"
"1146","the priestly office, laboring in the night."
"1147","  3. A dreadful god is our god Tezcatlipoca, he is the only god, he will"
"1148","answer us."
"1149","  4. His heart is in the Tezcatzontli; my god is not timid like a hare"
"1150","nor is he peaceable; I shall overturn, I shall penetrate the Mixcoatepec"
"1151","in Colhuacan."
"1152","  5. I sing, I play on an instrument, I am the noble instrument, the"
"1153","mirror; I am he who lifts the mirror; I cry aloud, intoxicated with the"
"1154","wine of the tuna."
"1155","_Notes._"
"1156","As before stated (Notes to Hymn VIII), Macuilxochitl is another title of"
"1157","the flower-god Xochipilli."
"1158","XX. _Yacatecutli icuic._"
"1159","  1. Anomatia aytoloc, anomatia aytoloc, tzocotzontla aytoloc,"
"1160","tzocotzontla anomatia aytoloc."
"1161","  2. Pipitla aytoloc, pipitla anomatia aytoloc, cholotla aytoloc,"
"1162","pipitla anomatia aytoloc."
"1163","  3. Tonacayutl nicmaceuh a√ßa naxcan noquacuillo atliyollo,"
"1164","nechualyauicatiaque xalli itepeuhya."
"1165","  4. Chalchiuhpetlacalco ni naxcan a√ßa naxcan noquacuillo, atliyollo"
"1166","nechualyauicatiaque xalli itepeuhya."
"1167","_Gloss._"
"1168","  1. Anomatia, _q.n._, amo nixpan in omito yauyutl inic otepeualoc"
"1169","tzocotzontla, amo nomatia in omito yauyutl."
"1170","  2. Pipitla aytoloc, _q.n._, ynic tepeualoc pipitla amo nicmati inic"
"1171","omito yauyutl, in cholotla ic otepeualloc amo nixpan ynic oyautlatolloc."
"1172","  3. Tonacayutl nicmaceuh, _q.n._, yn tonacayutl inic onicma√ßeuh"
"1173","ayaxcan, onechualhuicaque in oquacuiloan in xochayutl, in √ßoqniayutl in"
"1174","teuelteca, quimilhui in iquintonaz tlatuiz anoquacuiloan ayezque. Xalli"
"1175","tepeuhya, _id est_, tlalocan. Quilmach chalchiuhpetlacalli in quitepeuh"
"1176","inic tepeuh."
"1177","  4. Chalchiuhpetlacalco ninaxcan, _q.n._, onca ninotlati in chalchiuh"
"1178","petlacalco. Ayaxcan ynechualhuicatiaque yn oquacuiloan atliyoloa in umpa"
"1179","tlallocan."
"1180","_Hymn to Yacatecutli._"
"1181","  1. I know not what is said, I know not what is said, what is said"
"1182","about Tzocotzontlan, I know not what is said about Tzocotzontlan."
"1183","  2. I know not what is said of Pipitlan, what is said of Pipitlan, nor"
"1184","what is said of Cholollan, what of Pipitlan, of Pipitlan."
"1185","  3. Now I seek our food, proceeding to eat it and to drink of the"
"1186","water, going to where the sand begins."
"1187","  4. Now I go to my beautiful house, there to eat my food, and to drink"
"1188","of the water, going to where the sand begins."
"1189","_Notes._"
"1190","The god Yacatecutli, whose name means lord of travelers, or the lord
who guides, was the divinity of the merchants. Sahagun (_Historia_,"
"1191","Lib. I, cap. 19) and Duran (_Historia_, cap. 90) furnish us many"
"1192","particulars of his worship."
"1193","The hymn is extremely obscure, containing a number of archaic words, and"
"1194","my rendering is very doubtful. The writer of the Gloss is, I think, also"
"1195","at fault in his paraphrase. The general purpose of the hymn seems to be"
"1196","that of a death-song, chanted probably by the victims about to be"
