"","Ô..The.Project.Gutenberg.EBook.of.Rig.Veda.Americanus..by.Various"
"397","where the thick mist makes the cloudy house of Tlaloc."
"398","_Notes._"
"399","The god Tlaloc shared with Huitzilopochtli the highest place in the"
"400","Mexican Pantheon. He was the deity who presided over the waters, the"
"401","rains, the thunder and the lightning. The annual festival in his honor"
"402","took place about the time of corn-planting, and was intended to secure"
"403","his favor for this all-important crop. Its details are described at"
"404","great length by Diego Duran, _Historia de Nueva Espa√±a_, cap. 86, and"
"405","Sahagun, _Historia_, Lib. II., cap. 25, and elsewhere. His name is"
"406","derived from _tlalli_, earth. _Tlalocan_, referred to in v. 5, the
place of Tlaloc, was the name of a mountain east of Tenochtitlan, where"
"407","the festival of the god was celebrated; but it had also a mythical"
"408","meaning, equivalent to the earthly Paradise, the abode of happy souls."
"409","It will be observed that v. 10 is a repetition of v. 6. The word"
"410","_ayauicalo_ refers to the _ayauhcalli_, house of mist, the home of the"
"411","rain god, which Sahagun informs us was represented at the annual"
"412","festival by four small buildings near the water's edge, carefully"
"413","disposed to face the four cardinal points of the compass (Sahagun, _ubi"
"414","supra_)."
"415","In v. 8 the expression _tetzauhpilli_ (_tetzauhqui_, to frighten) may"
"416","be explained by the figure of Tlaloc, whose statue, says Duran, was that"
"417","of _un espantable monstruo, la cara muy fea_ (_ibid._)."
"418","The compound in v. 10, _nauhxiuhtica_, after four years, appears to"
"419","refer to the souls of the departed brave ones, who, according to Aztec"
"420","mythology, passed to the heaven for four years and after that returned"
"421","to the terrestrial Paradise,--the palace of Tlaloc. (See my paper, _The"
"422","Journey of the Soul_, in _Proceedings of the Numismatic and Antiquarian"
"423","Society of Philadelphia, 1883_.)"
"424","IV. _Teteuynan ycuic._"
"425","  1. Ahuiya co√ßauic xochitla oya cueponca yeua tonana teumechaue"
"426","moqui√ßican tamoanchan, auayye, auayya, yyao, yya, yyeo, aye ayo, ayy"
"427","ayyaa."
"428","  2. Co√ßauic xochitla oya moxocha yeua tonana, teumechaue, moqui√ßica"
"429","tamoanchan, ouayye, auayya, yyao, yya, yyeo, ayo aye, ayya, ayyaa."
"430","  3. Ahuia iztac xochitla, oya cueponca yeua tonana teumechaue moqui√ßica"
"431","tamoanchan, ouayye, auayya, yyao yya, yyeo, ayeaye, ayya ayyaa."
"432","  4. Ahuiya iztac xochitla oya moxocha yeua tonana teumechaue moqui√ßica"
"433","tamoanchan, ouayye, auayya, yyao, yya, yyeo, aye aye, ayya ayyaa."
"434","  5. Ahuia ohoya teutl ca teucontli paca tona aya, itzpapalotli, auayye,"
"435","yyao, yya, yyeo, ayyaa."
"436","  6. Ao, auatic ya itaca chicunauixtlauatla ma√ßatl yyollo, ica"
"437","mozcaltizqui tonan tlaltecutli, ayao, ayyao, ayyaa."
"438","  7. Aho, ye yancuic ti√ßatla ye yancuic yuitla oya potoniloc yn"
"439","auicacopa acatl xamontoca."
"440","  8. Aho ma√ßatl mochiuhca teutlalipan mitziya noittaco, yeua xiuhnello,"
"441","yeua mimichan."
"442","_Var._ 7. Xamantoca. 8. Yehoa."
"443","_Gloss._"
"444","  1. _Q.n._, in tonan ocueponya umpa oalquiz yn tamoanchan."
"445","  2. _Q.n._, in amona ca izcui yn xochiuh ca umpa oquiz yn tmoanchan."
"446","  3. _Q.n._ In tonan ocuepo in umpa oquiz tamoanchan."
"447","  4. _Q.n._, in amona iztac in oxochiuh yn umpa oniquiz tamoanchan."
"448","  5. _Q.n._, in tonan ca teucumitl icpac in quiz yn itzpapalotl."
"449","  6. _Q.n._, in tonan ixtlauan in mozcaltito auh inic mozcalti macatl y"
"450","yollo y yeua tonan tlaltecutli."
"451","  7. _Q.n._, auh inic potoniloc, tonan, yancuic ti√ßatl ioan yancuic yn"
"452","iuitl, auh nauhcampa quite ynacatl."
"453","  8. _Q.n._, in macatl yeuan can iliaya yn ixtlauacan yuhqui inic quic"
"454","noitayan y yeuatl inimich ioan in xiuhnel."
"455","_Hymn to the Mother of the Gods._"
"456","  1. Hail to our mother, who caused the yellow flowers to blossom, who"
"457","scattered the seeds of the maguey, as she came forth from Paradise."
"458","  2. Hail to our mother, who poured forth flowers in abundance, who"
"459","scattered the seeds of the maguey, as she came forth from Paradise."
"460","  3. Hail to our mother, who caused the yellow flowers to blossom, she"
"461","who scattered the seeds of the maguey, as she came forth from Paradise."
"462","  4. Hail to our mother, who poured forth white flowers in abundance,"
"463","who scattered the seeds of the maguey, as she came forth from Paradise."
"464","  5. Hail to the goddess who shines in the thorn bush like a bright"
"465","butterfly."
"466","  6. Ho! she is our mother, goddess of the earth, she supplies food in"
"467","the desert to the wild beasts, and causes them to live."
"468","  7. Thus, thus, you see her to be an ever-fresh model of liberality"
"469","toward all flesh."
"470","  8. And as you see the goddess of the earth do to the wild beasts, so"
"471","also does she toward the green herbs and the fishes."
"472","_Notes._"
"473","The goddess to whom this hymn is devoted was called _Teteoinan_, the"
"474","Mother of the Gods, _To√ßi_, our Mother (maternal ancestor), and also by"
"475","another name which signified the Heart of the Earth, the latter being"
"476","bestowed upon her, says Duran, because she was believed to be the cause"
"477","of earthquakes. Her general functions were those of a genius of"
"478","fertility, extending both to the vegetable and the animal world. Thus,"
"479","she was the patroness of the native midwives and of women in childbirth"
"480","(Sahagun). Her chief temple at Tepeyacac was one of the most renowned in"
"481","ancient Mexico, and it was a felicitous idea of the early missionaries"
"482","to have Our Lady of Guadalupe make her appearance on the immediate"
"483","site of this ancient fane already celebrated as the place of worship of"
"484","the older female deity. The _Codex Ramirez_ makes her a daughter of the"
"485","first King of Culhuacan."
"486","  1. _Tamoanchan._ This word Sahagun translates we seek our homes,"
"487","while the _Codex Telleriano-Remensis_ gives the more intelligible"
"488","rendering there is their home whither they descend, and adds that it"
"489","is synonymous with _Xochitlycacan_, the place where the flowers are
lifted. It was the mystical Paradise of the Aztecs, the Home of the"
"490","Gods, and the happy realm of departed souls. The Codex just quoted adds"
"491","that the gods were born there, which explains the introduction of the"
"492","word into this hymn."
"493","  5. For _teucontli_ (see Glossary) I should suggest _teocomitl_, a"
"494","species of ornament, (cf. Sahagun, _Historia_, Lib. II., cap. 37.)"
"495","V. _Chimalpanecatl icuic ioan tlaltecaua (nanotl)._"
"496","  1. Ichimalipan chipuchica ueya, mixiuiloc yautlatoaya, ichimalipan"
"497","chipuchica ueya, mixiuiloc yautlatoa."
"498","  2. Coatepec tequiua, tepetitla moxayaual teueuel aya quinelli"
"499","moquichtiuiui tlalli cuecuechiuia aqui moxayaual teueuella."
"500","_Var._ Title. Tlaltecaoannanotl. 2. Cohoatepechquiua."
"501","_Gloss._"
"502","  1. _Q.n._, yautlatolli ipa omixiuh ynanotl chimalipan in omixiuh, _id"
"503","est_, ipa oquitlacatilli ynanotl in uitzilopochtli y yauyutl."
"504","  2. _Q.n._, coatepec otepeuh tepetitla yc moxaual ioan y teueuel, _id"
"505","est_, ichimal ic otepeuh aocac omoquichquetz iniquac peualoque coatepec"
"506","a iniquac otlalli cuecuechiuh, _id est_, iquac opopoliuhque."
"507","_Hymn to Chimalipan in Parturition._"
"508","  1. Chimalipan was a virgin when she brought forth the adviser of"
"509","battles; Chimalipan was a virgin when she brought forth the adviser of"
"510","battles."
"511","  2. On the Coatepec was her labor; on the mountain he ripened into age;"
"512","as he became a man truly the earth was shaken, even as he became a man."
"513","_Notes._"
"514","The goddess Chimalipan is not mentioned by the authorities at my"
"515","command; but from the tenor of the hymn it is evident that the name is"
"516","a synonym for the virgin mother of Huitzilopochtli, who is distinctly"
"517","referred to by his title _Yautlatoani_ (see _ante_, p. 18). In the myth,"
"518","she dwelt upon the Coatepetl, the Serpent Mountain, on the site of"
"519","Tulan. For a full discussion of this myth I refer to my inquiry, _Were
the Toltecs an Historic Nationality?_ in _Proceedings of the Amer."
"520","Phil. Soc._ for Sept. 1887, and _American Hero-Myths_, chap. 11."
"521","(Phila., 1881)."
"522","The Gloss distinctly states that the mother of Huitzilopochtli is"
"523","referred to in the hymn. We must regard Chimalipan therefore as"
"524","identical with _Chimalman_, who, according to another myth dwelt in Tula"
"525","as a virgin, and was divinely impregnated by the descending spirit of"
"526","the All-father in the shape of a bunch of feathers."
"527","In other myths she is mentioned as also the mother of the Huitznahua,"
"528","the enemies and the brothers of Huitzilopochtli, referred to in the"
"529","second of this collection of chants."
"530","VI. _Ixco√ßauhqui icuic._"
"531","  1. Huiya tzonimolco notauane ye namech maya pinauhtiz, tetemoca ye"
"532","namech maya pinauhtiz."
"533","  2. Xonca mecatla notecua ic√ßotl mimilcatoc chicueyocan naualcalli"
"534","nauali temoquetlaya."
"535","  3. Huiya tzonimolco cuicotipeuhque, aya tzonimolco cuicotipeuhque, aya"
"536","iztleica naual moquizcauia, iztlauan naual moquizca."
"537","  4. Huia tzonimolco maceualli maya temacouia, oya tonaqui, oya tonaqui"
"538","maceualli, maya temacouiya."
"539","  5. Huiya tzonimolco xoxolcuicatl cacauantoc ya ayouica mocuiltonoaci"
"540","tontecuitl moteicnelil mauiztli."
"541","  6. Huiya ciuatontla xatenonotza, ayyauhcalcatl quiyauatla,"
"542","xatenonotza."
"543","_Var._ 2. Xoncan mecatlan notechoan. 3. Iztleica (for iztlauan). 6. Ia"
"544","ayiauhcalcatl."
"545","_Gloss._"
"546","  1. _Q.n._, yn itzonmolcatl notauane ye nemechpinauhtiz nachcan nochan"
"547","tetemoan, ye nemechpinauhtiz."
"548","  2. _Q.n._, yn mecatla amo tecuhuan in oncan ic√ßotl mimilcatoc"
"549","ueyaquixtoc ic√ßotl uncan in temoc in chicueyocan."
"550","  3. _Q.n._, yn tzonmolco otipeuhque macuico yn tzonmolco macuico"
"551","otipeuhque tleica in amo anualqui√ßa tleica yn ayaualqui√ßa."
"552","  4. _Q.n._, yn tzonmolco otonac auh in omaceualhoan xinechinacaqui"
"553","notechpouizque yn enetoltiloyan."
"554","  5. _Q.n._, yn cuicatl tzomolco ca ye cauani in aic necuiltonollo"
"555","netotilo in tetecuti yeua moteicnelil ca mauiztic."
"556","  6. _Q.n._, yn ciuatontli xitenonotza in quiauat ayauhcalcatl, _id"
"557","est_, in ticiuatontli xitenonotza."
"558","_Hymn to Ixco√ßauhqui._"
"559","  1. In the Hall of Flames let me not put to shame my ancestors;"
"560","descending there, let me not put you to shame."
"561","  2. I fasten a rope to the sacred tree, I twist it in eight folds, that"
"562","by it I, a magician, may descend to the magical house."
"563","  3. Begin your song in the Hall of Flames; begin your song in the Hall"
"564","of Flames; why does the magician not come forth? Why does he not rise"
"565","up?"
"566","  4. Let his subjects assist in the Hall of Flames; he appears, he"
"567","appears, let his subjects assist."
"568","  5. Let the servants never cease the song in the Hall of Flames; let"
"569","them rejoice greatly, let them dance wonderfully."
"570","  6. Call ye for the woman with abundant hair, whose care is the mist"
"571","and the rain, call ye for her."
"572","_Notes._"
"573","_Ixco√ßauhqui_, the Yellow Faced, was the Mexican God of Fire."
"574","Torquemada gives as his synonyms _Xiuhtecutli_, Lord of Fire, and"
"575","_Huehueteotl_, the Ancient God (_Monarquia Indiana_, Lib. VI., cap."
"576","28). Elsewhere he identifies him with the Sun-god (_Ibid._, Lib. XIV.,"
"577","cap. 4). Sahagun describes his annual festival (_Hist._, Lib. II., cap."
"578","38), and gives another of his names, _Cue√ßaltzin_, a reverential form of"
"579","_cuezalotl_, flame (_Hist._, Lib. I., cap. 13)."
"580","The _tzonmolco_ so often referred to in this hymn was the sixty-fourth"
"581","edifice in the great temple of Tenochtitlan, and was devoted to the"
"582","worship of Ixco√ßauhqui (Sahagun). The word literally means the place of
spreading hairs, the rays or ornaments spreading from the head of the"
"583","statue of the god representing flames (Sahagun)."
"584","The reference in v. 6 seems to be to one of the women who were"
"585","sacrificed at the festival, as related by Sahagun (Lib. II., App.)."
"586","VII. _Mimixcoa icuic._"
"587","  1. Chicomoztoc quinexaqui, √ßani aueponi, √ßani, √ßani, teyomi."
"588","  2. Tziuactitlan quinexaqui, √ßani a aueponi, √ßani, √ßani, teyomi."
"589","  3. Oya nitemoc, oya nitemoc, aya ica nitemoc notziuaquimiuh, aya ica"
"590","nitemoc notziuaquimiuh."
"591","  4. Oya nitemoc, oya nitemoc, ayayca nitemoc nomatlauacal."
"592","  5. Ni quimacui, ni quimacui, yuaya niquimacui, niquimacui, yuanya ayo"
"593","macuiui."
"594","  6. Tlachtli icpacaya, uel incuicaya, quetzalcuxcuxaya, quinanquilia"
"595","√ßinteutla, aay."
"596","_Var._ 1. Quinehoaqui. 2. Quineuaqui. 6. Ipac."
"597","_Gloss._"
"598","  1. _Q.n._, chicomoztoc oniualleuac √ßani aueponi, ichichimecatlatol,"
"599","√ßani aueponi, √ßani, √ßani teyomi."
"600","  2. _Q.n._, tziuactli in itlan oniualleuac √ßani aueponi, √ßani, √ßani"
"601","teyomi."
"602","  3. Oya nitemoc, _q.n._, onitemoc onitlacatl ipan ynotziuacmiuh;"
"603","onitemoc ipan ynotziuacmiuh √ßa niman ipan nitlacat ynotlauitol ynomiuh."
"604","  4. _Q.n._, onitemoc onitlacat inipan nomatlauacal √ßa niman ipan"
"605","nitlacat."
"606","  5. Y yacatlatol. Yc a a inya in chichimeca in chichimecatlatol."
"607","  6. _Q.n._, yn tlata√ßica tictecazque totlach uncan ticuicazque"
"608","noyehuatl in quetzalcocox."
"609","_Hymn of Mixcoatl._"
"610","  1. I come forth from Chicomoztoc, only to you, my friends, to you,"
"611","honored ones."
"612","  2. I come forth from Tziuactitlan, only to you my friends, only to you"
"613","honored ones."
"614","  3. I sought, I sought, in all directions I sought with my pack; in all"
"615","directions I sought with my pack."
"616","  4. I sought, I sought, in all directions I sought with my traveling"
"617","net."
"618","  5. I took them in hand, I took them in hand; yes, I took them in hand;"
"619","yes, I took them in hand."
"620","  6. In the ball ground I sang well and strong, like to the quetzal"
"621","bird; I answered back to the god."
"622","_Notes._"
"623","The Chichimecs, says Sahagun (_Hist._, Lib. VI., cap. 7), worshipped
only one god, called _Mixcoatl_. The _Anales de Cuauhtitlan_ speaks of"
"624","Mixcoatl as one of the leaders of the ancient Nahuas from their"
"625","primitive home Chicomoztoc, the land of the Seven Caves. This is what is"
"626","referred to in the above hymn. In later times Mixcoatl became god of"
"627","hunting and of the tornado, and his worship extended to the Otomis."
"628","_Tzihuactitlan_, the land of the tzihuac bushes, I have not found"
"629","mentioned by any of the Spanish authorities, but it is named in"
"630","connection with Chicomoztoc in an ancient war-song given in my _Ancient"
"631","Nahuatl Poetry_, pp. 88 and 140."
"632","The hymn appears to be in memory of the leadership of Mixcoatl in"
"633","conducting the ancestors of the Nahua on their long wanderings after"
"634","leaving their pristine seats. It should be read in connection with the"
"635","earlier pages of the _Annals of Cuauhtitlan_."
"636","The reduplicated form of the name, _Mimixcoatl_, is not found elsewhere,"
"637","and appears to be a poetic license."
"638","VIII. _Xochipilli icuic._"
"639","  1. Ye cuicaya tocniuaya ouaya yeo, ye cuicaya ye quetzalcoxcuxa"
"640","yoaltica tlao √ßinteutla, oay."
"641","  2. √áan quicaquiz nocuic ocoyoalle teumechaue, oquicaquiz nocuica in"
"642","cipactonalla atilili, ouayya."
"643","  3. Ayao, ayao, ayao, ayao, nitlanauati ay tlalocan tlamacazque, ayao,"
"644","ayao, ayao."
"645","  4. Ayao, ayao, ayao, tlalocan tlamacazque nitlanauati, aya, ayao,"
"646","ayyao."
"647","  5. Ao √ßani ualla√ßic, otli nepaniuia, cani √ßinteutla campa ye noyaz,"
"648","campa otli nicyatoca √ßa oay."
"649","  6. Ayao, aya, ayao, tlalocan tlamacazque, quiauiteteu, ayyao, aya,"
"650","ayao."
"651","_Gloss._"
"652","  1. _Q.n._, ca otonac, ca otlatuic ca ye cuico ca ye cuica centeotl in"
"653","quetzalcocox."
"654","  2. _Q.n._, macaco in tocuic ynican maquicaquican yn nican tlaca."
"655","  3. _Q.n._, in tlaloque tlamacazque niquinnauatia ye niauh in nochan."
"656","  4. _Q.n._, yn tlaloque tlamacazque niquinnauatia ye niauh in nochan."
"657","  5. _Q.n._, ca onitlanauati ni tlaloca catli ye nictocaz utli."
"658","  6. _Q.n._, yn antlaloque yn antlamacazque catli nictocaz yn anteteuh."
"659","_Hymn to Xochipilli._"
"660","  1. O friends, the quetzal bird sings, it sings its song at midnight to"
"661","Cinteotl."
"662","  2. The god will surely hear my song by night, he will hear my song as"
"663","the day begins to break."
"664","  3. I send forth the priests to the house of Tlaloc."
"665","  4. The priests to the house of Tlaloc do I send forth."
"666","  5. I shall go forth, I shall join myself unto them, I shall go where"
"667","is Cinteotl, I shall follow the path to him."
"668","  6. The priests go forth to the house of Tlaloc, to the home of the"
"669","gods of the plain."
"670","_Notes._"
"671","_Xochipilli_, lord of flowers, otherwise named _Macuilxochitl_, five
flowers (the name of a small odorous plant), was the deity who gave and"
"672","protected all flowering plants. As one of the gods of fertility and"
"673","production, he was associated with Tlaloc, god of rains, and Cinteotl,"
"674","god of maize. His festival is described in Sahagun (_Historia_, Lib. I.,"
"675","cap. 14)."
"676","  2. _Cipactonalla_, from _cipactli_, and _tonalli_, may refer to"
"677","_Cipactonal_, the reputed discoverer of the Aztec calendar. See"
"678","_Sahagun_, _Historia_, Lib. IV., cap. I."
"679","IX. _Xochiquetzal icuic._"
"680","  1. Atlayauican ni xochiquetzalli tlacya niuitza ya motencaliuan"
"681","tamoanchan oay."
"682","  2. Ye quitichocaya tlamacazecatla piltzintecutlo quiyatemoaya ye"
"683","xochinquetzalla xoyauia ay topa niaz, oay."
"684","_Var._ 2. Icotochiquetzalla."
"685","_Gloss._"
"686","  1. _Q.n._, ompa niuitz ynixochiquetzal tamoanchan."
"687","  2. _Q.n._, choca piltzintecutli quitemoa in xochiquetzal xoyauia no"
"688","umpa niaz."
"689","_Hymn to Xochiquetzal._"
"690","  1. I, Xochiquetzal, go forth willingly to the dancing place by the"
"691","water, going forth to the houses in Tamoanchan."
"692","  2. Ye noble youths, ye priests who wept, seeking Xochiquetzal, go"
"693","forth there where I am going."
"694","_Notes._"
"695","_Xochiquetzal_, plumage of flowers, was the deity of the artists, the"
"696","painters, weavers, engravers on metal, silver and goldsmiths, and of all"
"697","who dealt in fine colors. Her figure was that of a young woman with gay"
"698","garments and jewelry (Duran, _Historia_, cap. 94). In the _Codex"
"699","Telleriano-Remensis_ she is assigned as synonyms _Ichpochtli_, the"
"700","Virgin, and _Itzpapalotl_, literally the obsidian butterfly, but which"
"701","was probably applied to a peculiar ornament of her idol."
"702","On _Tamoanchan_ see notes to Hymn IV."
"703","The term _atlayauican_, which I have translated the dancing place by
the water, appears to refer to the jar dance, _baile de las jicaras_,"
"704","which took place at the festival of the goddess, in the month of"
"705","October. Duran informs us this was executed at a spot by the shore of"
"706","the lake. Ceremonial bathing was carried on at the same festival, and"
"707","these baths were considered to cleanse from sin, as well as from"
"708","physical pollution."
"709","X. _Amimitl icuic._"
"710","  1. Cotiuana, cotiuana, cali totoch maca huiya yyalimanico,"
"711","oquixanimanico, tlacochcalico, oua, yya yya, matonicaya, matonicalico,"
"712","oua yya yo, √ßana, √ßana, ayoueca niuia, √ßana canoya, ueca niuia, yya,"
"713","yya, yyeuaya, √ßana, √ßana, yeucua niuia."
"714","  2. Ye necuiliyaya, niuaya, niuaya, niuaya, ay ca nauh niuahuaya,"
"715","niuaya, niuaya, ay ca nauh."
"716","  3. Tlaixtotoca ye ca nauhtzini, tlaixtotoca ye ca nauhtzini, ayoaya,"
"717","yoaya, ye ca nauhtzini."
"718","  4. Aueya itzipana nomauilia, aueya itzipana nomauilia, aueya itzipana"
"719","nomauilia."
"720","_Var._ 1. Manca. Matinicaya."
"721","_Gloss._"
"722","In amimitl icuic yuh mitoa in ueli chichimeca cuic amo uel caquizti in"
"723","quein quitoa in tonauatlatol ypa."
"724","_Hymn to Amimitl._"
"725","  1. Join together your hands in the house, take hands in the sequent"
"726","course, let them spread forth, spread forth in the hall of arrows. Join"
"727","hands, join hands in the house, for this, for this have I come, have I"
"728","come."
"729","  2. Yes, I have come, bringing four with me, yes I have come, four"
"730","being with me."
"731","  3. Four noble ones, carefully selected, four noble ones, carefully"
"732","selected, yes, four noble ones."
"733","  4. They personally appear before his face, they personally appear"
"734","before his face, they personally appear before his face."
"735","_Notes._"
"736","The brief Gloss to this Hymn states that it is of ancient Chichimec"
"737","origin and that it cannot well be rendered in Nahuatl. Its language is"
"738","exceedingly obscure, but it is evidently a dancing song."
"739","_Amimitl_, the water-arrow, or fish-spear, was, according to"
"740","Torquemada, especially worshipped at Cuitlahuac. He was god of fishing,"
"741","and visited the subjects of his displeasure with diseases of a dropsical"
"742","or watery character (_Monarquia Indiana_, Lib. VI., cap. 29). On slender"
"743","and questionable grounds Clavigero identifies him with Opochtli, the god"
"744","of net makers and fishers with nets (_Storia Antica del Messico_, Tom."
"745","II., p. 20)."
"746","The four noble ones referred to in vv. 3 and 4 probably refer to those"
"747","characters in the Mexican sacred dances called the four auroras, four"
"748","actors clothed respectively in white, green, yellow and red robes. See"
"749","Diego Duran, _Historia_, cap. 87."
"750","XI. _Otontecutli icuic._"
"751","  1. Onoalico, onoalico, pomaya, yyaya, ayyo, ayyo, aya, aya, ayyo."
"752","  2. Chimalocutitlana motlaqueuia auetzini nonoualico, quauinochitla,"
"753","cacauatla motlaqueuia auetzini."
"754","  3. Ni tepanecatli aya cuecuexi, ni quetzallicoatli aya cuecuexi."
"755","  4. Cane ca ya itziueponi, cane ca ya itziueponi."
"756","  5. Otomico, noyoco, nauaco, mexicame ya yauilili, noyoco, nauaco,"
"757","mexicame ya."
"758","  6. A chimalli aya, xa, xauino quiyauilili, noyoco, nauaco, mexicame"
"759","ya."
"760","_Var._ 2. Nonoualco."
"761","_Hymn of Olontecutli._"
"762","  1. At Nonoalco he rules, at Nonoalco, Oho! Oho!"
"763","  2. In the pine woods he prepares your destruction at Nonoalco, in the"
"764","tuna woods, in the cacao woods he prepares your destruction."
"765","  3. I, dweller in the palace, shook them; I, Quetzalcoatl, shook them."
"766","  4. There was a splendor of spears, a splendor of spears."
"767","  5. With my captain, with my courage, with my skill, the Mexicans were"
"768","put to flight; even the Mexicans, with my courage, with my skill."
"769","  6. Go forth, ye shield bearers, put the Mexicans to flight with my"
"770","courage, with my skill."
"771","_Notes._"
"772","The absence of a Gloss to this hymn adds to the difficulty of a"
"773","translation. _Otontecutli_ was the chief deity of the Otomis, and the"
"774","chant appears to be one of their war songs in their conflict with the"
"775","Azteca. The name is a compound of _otomitl_, an Otomi, and _tecutli_,"
"776","ruler or lord. He is slightly referred to by Sahagun as the first ruler
to govern the ancestors of the Otomis. (_Historia_, Lib. X, cap. 29,"
"777","sec. 5.)"
"778","XII. _Ayopechtli icuic._"
"779","  1. Cane cana ichan, ayopechcatl cozcapantica mixiuhtoc."
"780","  2. Cane cana ichan ayopechcatl cozcapantica mixiuhtoc, cane ichan"
"781","chacayoticaya."
"782","  3. Xiualmeuayauia, xiua xiualmeuayaauiaya yancuipilla, xiualmeuaya."
"783","  4. Auiya xiualmeuaya, ueya, xiua, xiualmeuaya, cozcapilla xiualmeuaya."
"784","_Gloss._"
"785","  1. _Q.n._, in oncan ichan ayopechtli oncan mixiuiqui tlacatilia in"
"786","cuzcatl quetzalli."
"787","  2. Cane cana ichan, _q.n._, in oncan ichan ayopechcatl oncan"
"788","quitlacatilia in cozcatl quetzalli oncan yoliua, tlacatiua."
"789","  3. _Q.n._, ximeua, ximeua, in tipiltzintli xiualmeua in quinotitlacat"
"790","tipiltzintli."
"791","  4. _Q.n._, xiualmeua, xiualmeua, in tipiltzintli in ti cuzcatl, in ti"
"792","quetzalli."
"793","_Hymn to Ayopechcatl._"
"794","  1. Truly in whatever house there is a lying-in, Ayopechcatl takes"
"795","charge of the child."
"796","  2. Truly in whatever house there is a lying-in, Ayopechcatl takes"
"797","charge of the child, there where it is weeping in the house."
"798","  3. Come along and cry out, cry out, cry out, you new comer, come along"
"799","and cry out."
"800","  4. Come along and cry out, cry out, cry out, you little jewel, cry"
"801","out."
"802","_Notes._"
